<!ELEMENT person (first_name, last_name)>
<!ATTLIST person born CDATA #IMPLIED
                 died CDATA #IMPLIED>
 
<!-- born and died dates are in the form yyyy/mm/dd -->
<!ELEMENT date   (month, day, year)>
<!ELEMENT month  (#PCDATA)>
<!ELEMENT day    (#PCDATA)>
<!ELEMENT year   (#PCDATA)>
 
 
<!ELEMENT profession (#PCDATA)>
<!ELEMENT footnote   (#PCDATA)>
<!ATTLIST footnote source CDATA #REQUIRED>
 
<!ELEMENT first_name (#PCDATA)>
<!ELEMENT last_name  (#PCDATA)>
 
<!ELEMENT image EMPTY>
<!ATTLIST image source CDATA   #REQUIRED
                width  NMTOKEN #REQUIRED
                height NMTOKEN #REQUIRED
                ALT    CDATA   #IMPLIED
> 
<!ENTITY % top_level "( #PCDATA | image | paragraph | definition
                      | person | profession | emphasize | last_name
                      | first_name | footnote | date )*">
 
<!ELEMENT paragraph  %top_level; >
<!ELEMENT definition %top_level; >
<!ELEMENT emphasize  %top_level; >
<!ELEMENT biography  %top_level; >
 